1,101,Natalie,Sharpe,9,Freelance Senior Stylist,/dist/img/team/nat.jpg,https://9dd4398ac4d52ba12cab-f1aee8fa44b57276f7c290953cbe1cf5.ssl.cf5.rackcdn.com/team%20pics/Jakata/2025/nat.jpg,https://9dd4398ac4d52ba12cab-f1aee8fa44b57276f7c290953cbe1cf5.ssl.cf5.rackcdn.com/team%20pics/Jakata/2025/nat.jpg,"Meet Natalie, the seasoned leader at Jakata. With 15 years in hairdressing, her knack for crafting unique styles and her left-handed cutting skills define her creative flair.",,,Colour melts and creative colour,Schwarzkopf Bold Washes,160,1,nat
1,102,Matthew,Lane,9,Freelance Senior Stylist,/dist/img/team/matt.jpg,https://9dd4398ac4d52ba12cab-f1aee8fa44b57276f7c290953cbe1cf5.ssl.cf5.rackcdn.com/team%20pics/Jakata/2025/matt.jpg,https://9dd4398ac4d52ba12cab-f1aee8fa44b57276f7c290953cbe1cf5.ssl.cf5.rackcdn.com/team%20pics/Jakata/2025/matt.jpg,"Meet Matt, the dynamic addition with 11 years of hairdressing prowess at Jakata. His loveable, creative, and funny nature intertwines seamlessly, creating flawless cuts and transformative extensions.",,,"Creative colour and wavy, textured looks",Kevin Murphy Blonde.Angel range,160,2,matt
1,103,Lauren,Thompson,8,Senior Stylist,/dist/img/team/lauren.jpg,https://9dd4398ac4d52ba12cab-f1aee8fa44b57276f7c290953cbe1cf5.ssl.cf5.rackcdn.com/team%20pics/Jakata/2025/lauren.jpg,https://9dd4398ac4d52ba12cab-f1aee8fa44b57276f7c290953cbe1cf5.ssl.cf5.rackcdn.com/team%20pics/Jakata/2025/lauren.jpg,"Meet Lauren, Jakata's advanced stylist and educator, passionate about hair transformations and specialised in extensions. Her love for festivals and fine dining complements her knack for creating stunning looks.",,,"Funky cuts & colours, short cuts",Olaplex,160,3,lauren-t
1,104,Sarah,Cuddy,6,Advanced Stylist,/dist/img/team/sarah.jpg,https://9dd4398ac4d52ba12cab-f1aee8fa44b57276f7c290953cbe1cf5.ssl.cf5.rackcdn.com/team%20pics/Jakata/2025/sarah.jpg,https://9dd4398ac4d52ba12cab-f1aee8fa44b57276f7c290953cbe1cf5.ssl.cf5.rackcdn.com/team%20pics/Jakata/2025/sarah.jpg,"This is Sarah, the Junior Stylist who effortlessly blends welcoming vibes with natural beauty, crafting stylish hair transformations that reflect her easygoing yet ambitious nature.",,,Style,Product,130,4,sarah
1,105,Katie,Rathmill,4,Graduate Stylist,/dist/img/team/katie.jpg,https://9dd4398ac4d52ba12cab-f1aee8fa44b57276f7c290953cbe1cf5.ssl.cf5.rackcdn.com/team%20pics/Jakata/2025/katie.jpg,https://9dd4398ac4d52ba12cab-f1aee8fa44b57276f7c290953cbe1cf5.ssl.cf5.rackcdn.com/team%20pics/Jakata/2025/katie.jpg,"Meet Katie, the spirited graduate stylist fuelled by a passion for hair transformations. Her artistic finesse and dedication, coupled with an award-winning touch, make her a captivating asset to Jakata.",,,Style,Product,110,5,katie
1,106,Daisy,Heath,4,Graduate Stylist,/dist/img/team/daisy.jpg,https://9dd4398ac4d52ba12cab-f1aee8fa44b57276f7c290953cbe1cf5.ssl.cf5.rackcdn.com/team%20pics/Jakata/daisy.jpg,https://9dd4398ac4d52ba12cab-f1aee8fa44b57276f7c290953cbe1cf5.ssl.cf5.rackcdn.com/team%20pics/Jakata/daisy.jpg,"Here we have Daisy, a creative and kind Graduate Stylist at Jakata, dedicated to crafting unique hair transformations that boost confidence and exude style.",,,Style,Product,110,6,daisy